{"admission_report_sha256":"5d6091baff321789307de31471bda6627ae1922ff5222c9c94e83477baf91306","model":{"name":"qwen2.5-coder","ollama_digest":"sha256:0123456789abcdef0123456789abcdef0123456789abcdef0123456789abcdef","quantization":"q4_K_M","tag":"7b-instruct","upstream_revision":"synthetic-upstream-1"},"ollama":{"config":{"keep_alive":"5m","num_ctx":8192},"endpoint":"http://127.0.0.1:11434","runtime":"ollama","version":"0.11.4"},"output_license":"Apache-2.0","producer":{"name":"hermes-agent","profile":"Local Model Lab","revision":"c0ffee1c0ffee1c0ffee1c0ffee1c0ffee1c0ffe","version":"0.4.0"},"reasoning_retention":{"policy":"strip_hidden","strip_tags":["think"]},"repository":{"base_oid":"aaa111aaa111aaa111aaa111aaa111aaa111aaa1","head_oid":"bbb222bbb222bbb222bbb222bbb222bbb222bbb2","name":"synthetic-loop","owner":"rmems","url":"https://github.com/rmems/synthetic-loop"},"schema_version":"hermes_run_manifest_v1","verifier":{"artifacts":[],"identity":"pytest-local","outcome":null,"subject":{"raw_trace_id":"trace-run-unverified","run_id":"run-unverified","session_id":"sess-run-unverified","task_id":"task-run-unverified"},"version":"8.4.1"},"workspace":{"id":"ws-isolated-001","kind":"isolated"}}
